{
  "version": "2.2",
  "updated": "2026-01-18",
  "notes": "Cases 1-10 from WINE_MATCH_BENCHMARK.md. Cases 11-50 expand coverage for main markets + key failure modes. v2.2 adds producer field to all cases, standardizes challenge taxonomy, adds expected constraints to 20 key cases.",
  "instructions": {
    "purpose": "Benchmark fixture for evaluating wine search identity matching (primary) and enrichment retrieval (secondary).",
    "runner_modes": {
      "replay": "Use recorded SERP snapshots; deterministic; ranking-only. Recommended for CI.",
      "record": "Fetch live SERP once and write snapshots for replay.",
      "live": "Run full pipeline (SERP + fetch + extraction). Use for nightly/manual runs; enforce live-only expectations."
    },
    "scoring": {
      "identity": {
        "primary_metrics": ["hit@1", "hit@3", "mrr"],
        "match_basis": "Normalized text match against gold_canonical_name; when present, vintage must match (or be NV)."
      },
      "enrichment": {
        "tracked_metrics": ["corroborated_claims_count", "sources_count", "latency_ms", "serp_calls", "pages_fetched", "bytes_downloaded"],
        "note": "Enrichment should be evaluated separately from identity to avoid flakiness across vintages and web changes."
      }
    },
    "case_fields": {
      "required": ["id", "query", "country", "challenges", "gold_canonical_name", "producer"],
      "optional": {
        "vintage": "Integer year if vintage is known. Omit for NV wines.",
        "expected": {
          "min_results": "Minimum number of results expected in live mode.",
          "must_include_domains": "List of domains that must appear among top results in live mode.",
          "must_include_source_types": "List of source types required in live mode (e.g., producer_website, critic, competition)."
        },
        "notes": "Human explanation of why this case exists / what it stresses."
      }
    },
    "challenge_taxonomy": {
      "name_complexity": ["long_name", "very_long_name", "short_query", "hyphenated_producer", "apostrophe", "definite_article"],
      "diacritics": ["diacritics_optional", "umlaut_optional", "special_chars_optional", "accented_grape"],
      "classification": ["classification_reserva", "classification_gran_reserva", "premier_cru", "pradikat_term", "gg_term", "gg_abbrev", "igt_tokens"],
      "vineyard": ["single_vineyard", "vineyard_name", "vineyard_tokens", "finca_keyword", "estate_name", "estate_token"],
      "brand_producer": ["brand_vs_producer", "producer_as_brand", "brand_only", "brand_line", "brand_family_range", "producer_acronym", "producer_small_footprint"],
      "numeric": ["numeric_bin", "numeric_cuvee"],
      "region": ["subregion_token", "appellation_token", "region_tokens"],
      "special_types": ["non_vintage", "super_tuscan", "appassimento_style", "prestige_champagne"],
      "search_difficulty": ["retail_noise", "many_retail_pages", "icon_wine", "icon_wine_short_query", "rare_high_value", "high_value", "low_critic_coverage"]
    }
  },
  "cases": [
    {
      "id": "01_sa_nederburg_two_centuries_2019",
      "query": "Nederburg Private Bin Cabernet Sauvignon 2019",
      "country": "South Africa",
      "producer": "Nederburg",
      "vintage": 2019,
      "challenges": ["tier_name_hidden", "brand_vs_producer", "high_value"],
      "gold_canonical_name": "Nederburg Private Bin Two Centuries Cabernet Sauvignon 2019",
      "expected": {
        "min_results": 3,
        "must_include_domains": ["wine-searcher.com", "vivino.com"],
        "must_include_source_types": ["retailer", "aggregator"]
      },
      "notes": "Tier 'Two Centuries' hidden on physical label but present in databases"
    },
    {
      "id": "02_sa_kleine_zalze_vineyard_selection_2023",
      "query": "Kleine Zalze Chenin Blanc Vineyard Selection 2023",
      "country": "South Africa",
      "producer": "Kleine Zalze",
      "vintage": 2023,
      "challenges": ["range_qualifier", "tier_disambiguation"],
      "gold_canonical_name": "Kleine Zalze Vineyard Selection Chenin Blanc 2023",
      "notes": "Range qualifier 'Vineyard Selection' is meaningful tier, not noise"
    },
    {
      "id": "03_it_doppio_passo_primitivo_2021",
      "query": "Doppio Passo Primitivo 2021",
      "country": "Italy",
      "producer": "Botter",
      "vintage": 2021,
      "challenges": ["igt_tokens", "retail_noise"],
      "gold_canonical_name": "Doppio Passo Primitivo Salento IGT 2021",
      "notes": "High-volume commercial wine with many retail pages; IGT region tokens important"
    },
    {
      "id": "04_cl_san_pedro_1865_carmenere_2018",
      "query": "1865 Selected Vineyards Carmenere 2018",
      "country": "Chile",
      "producer": "Viña San Pedro",
      "vintage": 2018,
      "challenges": ["brand_vs_producer", "accented_grape"],
      "gold_canonical_name": "Viña San Pedro 1865 Selected Vineyards Carmenère 2018",
      "notes": "1865 is brand line; producer Viña San Pedro often hidden; Carmenère has accent"
    },
    {
      "id": "05_it_biscardo_enigma_2018",
      "query": "Biscardo Enigma 2018",
      "country": "Italy",
      "producer": "Biscardo",
      "vintage": 2018,
      "challenges": ["igt_tokens", "brand_only"],
      "gold_canonical_name": "Biscardo Enigma Sangiovese Rubicone IGT 2018",
      "notes": "Trade name 'Enigma' without grape; IGT classification important"
    },
    {
      "id": "06_it_prinsi_gaia_principe_2015",
      "query": "Prinsi Barbaresco Gaia Principe 2015",
      "country": "Italy",
      "producer": "Prinsi",
      "vintage": 2015,
      "challenges": ["single_vineyard", "producer_small_footprint"],
      "gold_canonical_name": "Prinsi Barbaresco Gaia Principe 2015",
      "notes": "Small producer with limited web presence; single vineyard designation"
    },
    {
      "id": "07_es_matsu_el_recio_2023",
      "query": "Matsu El Recio 2023",
      "country": "Spain",
      "producer": "Matsu",
      "vintage": 2023,
      "challenges": ["brand_family_range", "low_critic_coverage"],
      "gold_canonical_name": "Matsu El Recio 2023",
      "notes": "Matsu is brand with El Recio/El Viejo/El Picaro family; recent vintage may lack critic scores"
    },
    {
      "id": "08_fr_albert_bichot_origines_2023",
      "query": "Albert Bichot Bourgogne Pinot Noir Origins 2023",
      "country": "France",
      "producer": "Albert Bichot",
      "vintage": 2023,
      "challenges": ["translation_variant", "generic_appellation"],
      "gold_canonical_name": "Albert Bichot Bourgogne Pinot Noir Origines 2023",
      "notes": "English 'Origins' vs French 'Origines'; generic Bourgogne appellation has many similar wines"
    },
    {
      "id": "09_sa_rijks_reserve_chenin_2024",
      "query": "Rijks Reserve Chenin Blanc 2024",
      "country": "South Africa",
      "producer": "Rijk's",
      "vintage": 2024,
      "challenges": ["classification_reserva", "tier_disambiguation", "apostrophe"],
      "gold_canonical_name": "Rijk's Reserve Chenin Blanc 2024",
      "notes": "Apostrophe in producer name; Reserve tier must not match Touch of Oak or other lines"
    },
    {
      "id": "10_sa_backsberg_the_patriarch_2022",
      "query": "Backsberg Patriarch 2022",
      "country": "South Africa",
      "producer": "Backsberg",
      "vintage": 2022,
      "challenges": ["definite_article", "flagship"],
      "gold_canonical_name": "Backsberg The Patriarch Cabernet Franc 2022",
      "expected": {
        "min_results": 3,
        "must_include_domains": ["wine-searcher.com"],
        "must_include_source_types": ["retailer"]
      },
      "notes": "Query missing 'The'; flagship wine so rating miss is critical"
    },
    {
      "id": "11_ar_catena_adrianna_fortuna_terrae_2018",
      "query": "Catena Zapata Adrianna Vineyard Fortuna Terrae Malbec 2018",
      "country": "Argentina",
      "producer": "Catena Zapata",
      "vintage": 2018,
      "challenges": ["single_vineyard", "very_long_name", "vineyard_tokens", "high_value"],
      "gold_canonical_name": "Catena Zapata Adrianna Vineyard Fortuna Terrae Malbec 2018",
      "expected": {
        "min_results": 5,
        "must_include_domains": ["wine-searcher.com", "jamesuckling.com"],
        "must_include_source_types": ["critic", "aggregator"]
      },
      "notes": "Top-tier Argentine wine with very long name; multiple vineyard tokens"
    },
    {
      "id": "12_ar_zuccardi_piedra_infinita_2019",
      "query": "Zuccardi Finca Piedra Infinita Malbec 2019",
      "country": "Argentina",
      "producer": "Zuccardi",
      "vintage": 2019,
      "challenges": ["finca_keyword", "single_vineyard"],
      "gold_canonical_name": "Zuccardi Finca Piedra Infinita Malbec 2019",
      "notes": "Finca (estate) keyword important for identity; single vineyard wine"
    },
    {
      "id": "13_ar_achaval_ferrer_altamira_2019",
      "query": "Achaval-Ferrer Finca Altamira Malbec 2019",
      "country": "Argentina",
      "producer": "Achaval-Ferrer",
      "vintage": 2019,
      "challenges": ["hyphenated_producer", "finca_keyword"],
      "gold_canonical_name": "Achaval-Ferrer Finca Altamira Malbec 2019",
      "notes": "Hyphenated producer name; Finca designation"
    },
    {
      "id": "14_ar_el_enemigo_malbec_2020",
      "query": "El Enemigo Malbec 2020",
      "country": "Argentina",
      "producer": "El Enemigo",
      "vintage": 2020,
      "challenges": ["brand_only", "spanish_article"],
      "gold_canonical_name": "El Enemigo Malbec 2020",
      "notes": "Brand without clear producer attribution; Spanish article 'El' in name"
    },
    {
      "id": "15_cl_marques_de_casa_concha_2019",
      "query": "Concha y Toro Marques de Casa Concha Cabernet Sauvignon 2019",
      "country": "Chile",
      "producer": "Concha y Toro",
      "vintage": 2019,
      "challenges": ["diacritics_optional", "brand_line"],
      "gold_canonical_name": "Concha y Toro Marqués de Casa Concha Cabernet Sauvignon 2019",